{
  "storyboardVersion": 1,
  "deck": {
    "id": "brightleaf-spring",
    "title": "What the spring campaign taught Brightleaf",
    "subtitle": "Fictional campaign results, not real data",
    "intro": "A fictional demo about a made-up tea company. Every figure comes from the source brief. Sound is on, best viewed fullscreen.",
    "language": "en",
    "theme": "ink-ember",
    "fictional": true,
    "titleAccent": "spring"
  },
  "sources": [
    {
      "id": "p2",
      "kind": "document",
      "label": "Click-through paragraph",
      "locator": "p2"
    },
    {
      "id": "p3",
      "kind": "document",
      "label": "Cost paragraph",
      "locator": "p3"
    },
    {
      "id": "p4",
      "kind": "document",
      "label": "Email paragraph",
      "locator": "p4"
    }
  ],
  "facts": [
    {
      "id": "ctr-before",
      "kind": "number",
      "value": 1.8,
      "display": "1.8%",
      "unit": "%",
      "sourceRef": "p2",
      "evidence": "Click-through rate rose from 1.8% to 3.4%."
    },
    {
      "id": "ctr-now",
      "kind": "number",
      "value": 3.4,
      "display": "3.4%",
      "unit": "%",
      "sourceRef": "p2",
      "evidence": "Click-through rate rose from 1.8% to 3.4%."
    },
    {
      "id": "cps-before",
      "kind": "number",
      "value": 12,
      "display": "$12",
      "sourceRef": "p3",
      "evidence": "Cost per sign-up fell from $12 to $7."
    },
    {
      "id": "cps-now",
      "kind": "number",
      "value": 7,
      "display": "$7",
      "sourceRef": "p3",
      "evidence": "Cost per sign-up fell from $12 to $7."
    },
    {
      "id": "emails",
      "kind": "number",
      "value": 5200,
      "display": "5,200",
      "sourceRef": "p4",
      "evidence": "The email list grew by 5,200 subscribers during the campaign."
    },
    {
      "id": "cps-drop",
      "kind": "number",
      "value": 5,
      "display": "$5",
      "derivation": {
        "op": "diff",
        "of": [
          "cps-before",
          "cps-now"
        ]
      }
    }
  ],
  "scenes": [
    {
      "id": "open",
      "chapter": "THE TEST",
      "kicker": "Opening",
      "mood": "quiet",
      "letterbox": true,
      "recipe": "minimal-close",
      "inputs": {
        "variant": "open",
        "line1": "Banners were not working.",
        "line2": "So we tried a different story.",
        "emphasis": "different",
        "bigWord": "Spring campaign.",
        "caption": "BRIGHTLEAF · FICTIONAL RESULTS"
      },
      "beats": [
        {
          "n": 1,
          "notes": "The team tested banners against short video."
        },
        {
          "n": 2,
          "notes": "The results were clear."
        },
        {
          "n": 3,
          "notes": "This is fictional data for a made-up company."
        }
      ]
    },
    {
      "id": "clicks",
      "chapter": "THE LIFT",
      "kicker": "Click-through",
      "title": "Clicks nearly doubled.",
      "mood": "tense",
      "recipe": "gauge-needle",
      "inputs": {
        "scale": {
          "min": 0,
          "max": 5,
          "majorStep": 1,
          "minorStep": 0.5,
          "unit": "%"
        },
        "before": {
          "fact": "ctr-before"
        },
        "after": {
          "fact": "ctr-now"
        },
        "labelBefore": "CLICK-THROUGH · BANNERS",
        "labelAfter": "CLICK-THROUGH · VIDEO",
        "afterTone": "positive"
      },
      "beats": [
        {
          "n": 1,
          "notes": "Click-through rate is how many viewers click."
        },
        {
          "n": 2,
          "notes": "Banners earned 1.8%."
        },
        {
          "n": 3,
          "notes": "The short video reached 3.4%."
        }
      ]
    },
    {
      "id": "cost",
      "chapter": "THE COST",
      "kicker": "Cost per sign-up",
      "title": "Sign-ups got cheaper.",
      "mood": "rising",
      "recipe": "range-bar-chart",
      "inputs": {
        "scale": {
          "min": 0,
          "max": 15,
          "majorStep": 5,
          "step": 5,
          "unit": ""
        },
        "rows": [
          {
            "label": "BEFORE",
            "value": {
              "fact": "cps-before"
            },
            "tone": "negative"
          },
          {
            "label": "NOW",
            "value": {
              "fact": "cps-now"
            },
            "tone": "positive"
          }
        ],
        "verdict": {
          "kicker": "THE RESULT",
          "word": "CHEAPER.",
          "sub": "Same budget, better value."
        },
        "gap": {
          "from": {
            "row": 1,
            "edge": "hi"
          },
          "to": {
            "row": 0,
            "edge": "hi"
          },
          "value": {
            "fact": "cps-drop"
          }
        },
        "cards": [
          {
            "head": "SAME BUDGET",
            "text": "The spend stayed flat."
          },
          {
            "head": "BETTER RESULT",
            "text": "Each sign-up cost less."
          }
        ],
        "axisLabel": "DOLLARS PER SIGN-UP"
      },
      "beats": [
        {
          "n": 1,
          "notes": "Cost per sign-up is what each new subscriber costs."
        },
        {
          "n": 2,
          "notes": "It was $12."
        },
        {
          "n": 3,
          "notes": "It fell to $7."
        },
        {
          "n": 4,
          "notes": "The budget did not change."
        },
        {
          "n": 5,
          "notes": "Video made the money work harder."
        }
      ]
    },
    {
      "id": "list",
      "chapter": "THE BONUS",
      "kicker": "The email list",
      "title": "The list kept growing.",
      "mood": "tense",
      "recipe": "range-bar-chart",
      "inputs": {
        "scale": {
          "min": 0,
          "max": 8000,
          "majorStep": 2000,
          "step": 2000,
          "unit": ""
        },
        "rows": [
          {
            "label": "NEW SUBSCRIBERS",
            "value": {
              "fact": "emails"
            },
            "tone": "accent"
          }
        ],
        "verdict": {
          "kicker": "THE BONUS",
          "word": "EMAILS.",
          "sub": "The weekly email earns its place."
        },
        "axisLabel": "SUBSCRIBERS ADDED"
      },
      "beats": [
        {
          "n": 1,
          "notes": "The campaign also grew the email list."
        },
        {
          "n": 2,
          "notes": "It added 5,200 subscribers."
        },
        {
          "n": 3,
          "notes": "That is why the email stays."
        }
      ]
    },
    {
      "id": "answer",
      "chapter": "THE ANSWER",
      "kicker": "The answer",
      "mood": "rising",
      "recipe": "strike-three-moves-checklist",
      "inputs": {
        "headlineLead": "STOP BUYING",
        "headlineStruck": "BANNERS.",
        "sub": {
          "lead": "Put the money into ",
          "accent": "short video."
        },
        "moves": [
          {
            "head": "MOVE THE MONEY",
            "text": "From banners to short video."
          },
          {
            "head": "KEEP THE EMAIL",
            "text": "The weekly email stays."
          },
          {
            "head": "BACK THE WINNER",
            "text": "Short video performed best."
          }
        ],
        "checklist": [
          "Cut banner spend",
          "Fund short video",
          "Keep the weekly email"
        ]
      },
      "beats": [
        {
          "n": 1,
          "notes": "Banners were the weakest channel."
        },
        {
          "n": 2,
          "notes": "The recommendation is simple."
        },
        {
          "n": 3,
          "notes": "Three moves."
        },
        {
          "n": 4,
          "notes": "This is the plan."
        }
      ]
    },
    {
      "id": "close",
      "chapter": "BACK THE WINNER",
      "kicker": "Closing",
      "mood": "quiet",
      "letterbox": true,
      "recipe": "minimal-close",
      "inputs": {
        "variant": "close",
        "line1": "Banners had their chance,",
        "line2": "short video earned the budget.",
        "emphasis": "earned the budget",
        "bigWord": "Back the winner.",
        "caption": "BRIGHTLEAF · FICTIONAL RESULTS",
        "thanks": "Thank you."
      },
      "beats": [
        {
          "n": 1,
          "notes": "Banners had their chance."
        },
        {
          "n": 2,
          "notes": "Short video earned the budget."
        },
        {
          "n": 3,
          "notes": "Thank you. This was fictional."
        }
      ]
    }
  ]
}