{
  "storyboardVersion": 1,
  "deck": {
    "id": "kestrel-onboarding",
    "title": "Why Kestrel new hires leave early",
    "subtitle": "Fictional HR review, not real data",
    "intro": "A fictional demo about a made-up freight company. Every figure comes from the source brief. Sound is on, best viewed fullscreen.",
    "language": "en",
    "theme": "ink-ember",
    "fictional": true,
    "titleAccent": "leave early"
  },
  "sources": [
    {
      "id": "p2",
      "kind": "document",
      "label": "Exit paragraph",
      "locator": "p2"
    },
    {
      "id": "p3",
      "kind": "document",
      "label": "Manager meeting paragraph",
      "locator": "p3"
    },
    {
      "id": "p4",
      "kind": "document",
      "label": "Engagement paragraph",
      "locator": "p4"
    }
  ],
  "facts": [
    {
      "id": "avg-exit",
      "kind": "number",
      "value": 9,
      "display": "9%",
      "unit": "%",
      "sourceRef": "p2",
      "evidence": "The company average is 9%."
    },
    {
      "id": "new-exit",
      "kind": "number",
      "value": 22,
      "display": "22%",
      "unit": "%",
      "sourceRef": "p2",
      "evidence": "22% of new hires leave within their first 90 days."
    },
    {
      "id": "day",
      "kind": "number",
      "value": 11,
      "display": "day 11",
      "sourceRef": "p3",
      "evidence": "New hires meet their manager for a first one-to-one on day 11, on average."
    },
    {
      "id": "eng-new",
      "kind": "number",
      "value": 61,
      "display": "61",
      "sourceRef": "p4",
      "evidence": "Engagement scores for people in their first year are 61, against 78 for longer-serving staff."
    },
    {
      "id": "eng-old",
      "kind": "number",
      "value": 78,
      "display": "78",
      "sourceRef": "p4",
      "evidence": "Engagement scores for people in their first year are 61, against 78 for longer-serving staff."
    }
  ],
  "scenes": [
    {
      "id": "open",
      "chapter": "THE FIRST DAYS",
      "kicker": "Opening",
      "mood": "quiet",
      "letterbox": true,
      "recipe": "minimal-close",
      "inputs": {
        "variant": "open",
        "line1": "New people arrive full of hope.",
        "line2": "Many leave before it shows.",
        "emphasis": "leave",
        "bigWord": "The early exits.",
        "caption": "KESTREL · FICTIONAL HR REVIEW"
      },
      "beats": [
        {
          "n": 1,
          "notes": "New hires arrive ready to work."
        },
        {
          "n": 2,
          "notes": "Too many leave very early."
        },
        {
          "n": 3,
          "notes": "This is a fictional review of a made-up company."
        }
      ]
    },
    {
      "id": "exits",
      "chapter": "THE PROBLEM",
      "kicker": "The problem",
      "title": "New hires leave early.",
      "mood": "tense",
      "recipe": "gauge-needle",
      "inputs": {
        "scale": {
          "min": 0,
          "max": 30,
          "majorStep": 10,
          "minorStep": 5,
          "unit": "%"
        },
        "before": {
          "fact": "avg-exit"
        },
        "after": {
          "fact": "new-exit"
        },
        "labelBefore": "COMPANY AVERAGE EXITS",
        "labelAfter": "NEW HIRE EXITS",
        "afterTone": "negative"
      },
      "beats": [
        {
          "n": 1,
          "notes": "Compare early exits with the company average."
        },
        {
          "n": 2,
          "notes": "The company average is 9%."
        },
        {
          "n": 3,
          "notes": "For new hires it is 22%."
        }
      ]
    },
    {
      "id": "engage",
      "chapter": "THE SIGNAL",
      "kicker": "The signal",
      "title": "Engagement lags early.",
      "mood": "tense",
      "recipe": "range-bar-chart",
      "inputs": {
        "scale": {
          "min": 0,
          "max": 100,
          "majorStep": 25,
          "step": 25,
          "unit": ""
        },
        "rows": [
          {
            "label": "FIRST YEAR",
            "value": {
              "fact": "eng-new"
            },
            "tone": "negative"
          },
          {
            "label": "LONGER-SERVING",
            "value": {
              "fact": "eng-old"
            },
            "tone": "accent"
          }
        ],
        "verdict": {
          "kicker": "THE SIGNAL",
          "word": "UNCLEAR.",
          "sub": "No clear role, no early feedback."
        },
        "cards": [
          {
            "head": "FIRST MANAGER MEETING",
            "text": "It happens on day 11, on average."
          },
          {
            "head": "EXIT INTERVIEWS",
            "text": "Unclear roles, no early feedback."
          }
        ],
        "axisLabel": "ENGAGEMENT SCORE"
      },
      "beats": [
        {
          "n": 1,
          "notes": "Engagement scores tell the same story."
        },
        {
          "n": 2,
          "notes": "First-year staff score 61."
        },
        {
          "n": 3,
          "notes": "Longer-serving staff score 78."
        },
        {
          "n": 4,
          "notes": "Two cards add the context."
        },
        {
          "n": 5,
          "notes": "Exit interviews mention unclear roles and no early feedback."
        }
      ]
    },
    {
      "id": "plan",
      "chapter": "THE PLAN",
      "kicker": "The plan",
      "title": "A better first month.",
      "mood": "rising",
      "recipe": "pillars-roof",
      "inputs": {
        "roofLabel": "A STRUCTURED FIRST MONTH",
        "pillars": [
          {
            "heading": "STRUCTURE",
            "items": [
              "A structured first month"
            ]
          },
          {
            "heading": "BUDDY",
            "items": [
              "A named buddy for every new hire"
            ]
          },
          {
            "heading": "CHECK-IN",
            "items": [
              "A check-in in week one"
            ]
          }
        ]
      },
      "beats": [
        {
          "n": 1,
          "notes": "The people team proposes a structured first month."
        },
        {
          "n": 2,
          "notes": "Structure gives people a clear role."
        },
        {
          "n": 3,
          "notes": "A buddy gives them somewhere to ask."
        },
        {
          "n": 4,
          "notes": "A week-one check-in gives early feedback."
        },
        {
          "n": 5,
          "notes": "Together they fix the early gap."
        }
      ]
    },
    {
      "id": "close",
      "chapter": "STAY",
      "kicker": "Closing",
      "mood": "quiet",
      "letterbox": true,
      "recipe": "minimal-close",
      "inputs": {
        "variant": "close",
        "line1": "People leave when they are lost,",
        "line2": "they stay when someone shows the way.",
        "emphasis": "someone shows the way",
        "bigWord": "Show the way.",
        "caption": "KESTREL · FICTIONAL HR REVIEW",
        "thanks": "Thank you."
      },
      "beats": [
        {
          "n": 1,
          "notes": "People leave when they feel lost."
        },
        {
          "n": 2,
          "notes": "They stay when someone shows the way."
        },
        {
          "n": 3,
          "notes": "Thank you. This was fictional."
        }
      ]
    }
  ]
}