{
  "storyboardVersion": 1,
  "deck": {
    "id": "arcdesk-renewals",
    "title": "Why ArcDesk loses customers",
    "subtitle": "Fictional brief, not real data",
    "intro": "A fictional demo about a made-up help-desk company. Every figure comes from the source brief. Sound is on, best viewed fullscreen.",
    "language": "en",
    "theme": "ink-ember",
    "fictional": true,
    "titleAccent": "loses"
  },
  "sources": [
    {
      "id": "p2",
      "kind": "document",
      "label": "Churn paragraph",
      "locator": "p2"
    },
    {
      "id": "p3",
      "kind": "document",
      "label": "Exit survey paragraph",
      "locator": "p3"
    },
    {
      "id": "p4",
      "kind": "document",
      "label": "Competitor discount paragraph",
      "locator": "p4"
    }
  ],
  "facts": [
    {
      "id": "churn-before",
      "kind": "number",
      "value": 3,
      "display": "3%",
      "unit": "%",
      "sourceRef": "p2",
      "evidence": "Monthly customer churn rose from 3% to 7% over the last two quarters."
    },
    {
      "id": "churn-now",
      "kind": "number",
      "value": 7,
      "display": "7%",
      "unit": "%",
      "sourceRef": "p2",
      "evidence": "Monthly customer churn rose from 3% to 7% over the last two quarters."
    },
    {
      "id": "price-reason",
      "kind": "number",
      "value": 41,
      "display": "41%",
      "unit": "%",
      "sourceRef": "p3",
      "evidence": "Exit surveys show 41% of leaving customers named price as the main reason, compared with 12% who named missing features."
    },
    {
      "id": "features-reason",
      "kind": "number",
      "value": 12,
      "display": "12%",
      "unit": "%",
      "sourceRef": "p3",
      "evidence": "Exit surveys show 41% of leaving customers named price as the main reason, compared with 12% who named missing features."
    },
    {
      "id": "rival-disc",
      "kind": "range",
      "value": {
        "lo": 15,
        "hi": 25
      },
      "display": "15–25%",
      "sourceRef": "p4",
      "evidence": "Competitors are offering discounts of 15–25% to ArcDesk's mid-size accounts."
    },
    {
      "id": "our-disc",
      "kind": "range",
      "value": {
        "lo": 5,
        "hi": 8
      },
      "display": "5–8%",
      "sourceRef": "p4",
      "evidence": "ArcDesk's own loyalty discount is 5–8%."
    },
    {
      "id": "disc-gap",
      "kind": "number",
      "value": 7,
      "display": "7 points",
      "derivation": {
        "op": "diff",
        "of": [
          "rival-disc.lo",
          "our-disc.hi"
        ]
      }
    }
  ],
  "scenes": [
    {
      "id": "open",
      "chapter": "THE LEAK",
      "kicker": "Opening",
      "mood": "quiet",
      "letterbox": true,
      "recipe": "minimal-close",
      "inputs": {
        "variant": "open",
        "line1": "Customers keep leaving.",
        "line2": "Nobody wants a price war.",
        "emphasis": "price war",
        "bigWord": "Renewal trouble.",
        "caption": "ARCDESK · FICTIONAL BRIEF"
      },
      "beats": [
        {
          "n": 1,
          "notes": "Customers are leaving and the team is under pressure."
        },
        {
          "n": 2,
          "notes": "Leadership does not want to start a price war."
        },
        {
          "n": 3,
          "notes": "This is a fictional brief about a made-up company."
        }
      ]
    },
    {
      "id": "churn",
      "chapter": "THE PROBLEM",
      "kicker": "The problem",
      "title": "Churn is climbing.",
      "mood": "tense",
      "recipe": "gauge-needle",
      "inputs": {
        "scale": {
          "min": 0,
          "max": 10,
          "majorStep": 5,
          "minorStep": 1,
          "unit": "%"
        },
        "before": {
          "fact": "churn-before"
        },
        "after": {
          "fact": "churn-now"
        },
        "labelBefore": "MONTHLY CHURN · BEFORE",
        "labelAfter": "MONTHLY CHURN · NOW",
        "afterTone": "negative",
        "caption": "More customers leave every month."
      },
      "beats": [
        {
          "n": 1,
          "notes": "Churn is the share of customers who leave each month."
        },
        {
          "n": 2,
          "notes": "It used to be 3%."
        },
        {
          "n": 3,
          "notes": "Now it is 7%, over two quarters."
        }
      ]
    },
    {
      "id": "reasons",
      "chapter": "THE REASON",
      "kicker": "The reason",
      "title": "Why customers leave.",
      "mood": "tense",
      "recipe": "range-bar-chart",
      "inputs": {
        "scale": {
          "min": 0,
          "max": 60,
          "majorStep": 20,
          "step": 10,
          "unit": "%"
        },
        "rows": [
          {
            "label": "NAMED PRICE",
            "value": {
              "fact": "price-reason"
            },
            "tone": "negative"
          },
          {
            "label": "NAMED FEATURES",
            "value": {
              "fact": "features-reason"
            },
            "tone": "secondary"
          }
        ],
        "verdict": {
          "kicker": "THE MAIN REASON",
          "word": "PRICE.",
          "sub": "Far ahead of missing features."
        }
      },
      "beats": [
        {
          "n": 1,
          "notes": "Exit surveys tell us why people go."
        },
        {
          "n": 2,
          "notes": "41% named price as the main reason."
        },
        {
          "n": 3,
          "notes": "Only 12% named missing features."
        },
        {
          "n": 4,
          "notes": "Price is the leading reason."
        }
      ]
    },
    {
      "id": "discounts",
      "chapter": "THE GAP",
      "kicker": "The gap",
      "title": "Rivals discount harder.",
      "mood": "tense",
      "recipe": "range-bar-chart",
      "inputs": {
        "scale": {
          "min": 0,
          "max": 40,
          "majorStep": 10,
          "step": 10,
          "unit": "%"
        },
        "rows": [
          {
            "label": "COMPETITORS",
            "value": {
              "fact": "rival-disc"
            },
            "tone": "negative"
          },
          {
            "label": "OUR DISCOUNT",
            "value": {
              "fact": "our-disc"
            },
            "tone": "accent"
          }
        ],
        "verdict": {
          "kicker": "THE GAP",
          "word": "BIG.",
          "sub": "Rival discounts outrun our loyalty offer."
        },
        "gap": {
          "from": {
            "row": 1,
            "edge": "hi"
          },
          "to": {
            "row": 0,
            "edge": "lo"
          },
          "value": {
            "fact": "disc-gap"
          }
        },
        "cards": [
          {
            "head": "MID-SIZE ACCOUNTS",
            "text": "These are the accounts at risk."
          },
          {
            "head": "NO PRICE WAR",
            "text": "Leadership wants another way."
          }
        ],
        "axisLabel": "DISCOUNT OFFERED"
      },
      "beats": [
        {
          "n": 1,
          "notes": "Competitors target our mid-size accounts with discounts of 15–25%."
        },
        {
          "n": 2,
          "notes": "Ours is 5–8%."
        },
        {
          "n": 3,
          "notes": "The bracket shows the gap, 7 points."
        },
        {
          "n": 4,
          "notes": "Two cards explain why it matters."
        },
        {
          "n": 5,
          "notes": "The gap is large."
        }
      ]
    },
    {
      "id": "answer",
      "chapter": "THE ANSWER",
      "kicker": "The answer",
      "mood": "rising",
      "recipe": "strike-three-moves-checklist",
      "inputs": {
        "headlineLead": "DON'T START A",
        "headlineStruck": "PRICE WAR.",
        "sub": {
          "lead": "Protect the ",
          "accent": "mid-size accounts."
        },
        "moves": [
          {
            "head": "SEE THE CAUSE",
            "text": "Price is the reason named most."
          },
          {
            "head": "READ THE GAP",
            "text": "Compare their discounts with ours."
          },
          {
            "head": "PROTECT THEM",
            "text": "Keep mid-size accounts without a war."
          }
        ],
        "checklist": [
          "Name price as the main cause",
          "Compare competitor and own discounts",
          "Protect mid-size accounts, no price war"
        ]
      },
      "beats": [
        {
          "n": 1,
          "notes": "Matching every discount would hurt us."
        },
        {
          "n": 2,
          "notes": "The better answer is to protect the accounts that matter."
        },
        {
          "n": 3,
          "notes": "Three moves follow from the evidence."
        },
        {
          "n": 4,
          "notes": "This is the checklist."
        }
      ]
    },
    {
      "id": "close",
      "chapter": "REASONS TO STAY",
      "kicker": "Closing",
      "mood": "quiet",
      "letterbox": true,
      "recipe": "minimal-close",
      "inputs": {
        "variant": "close",
        "line1": "Price pulls customers away,",
        "line2": "but a smart plan can win them back.",
        "emphasis": "smart plan",
        "bigWord": "No war, a plan.",
        "caption": "ARCDESK · FICTIONAL BRIEF",
        "thanks": "Thank you."
      },
      "beats": [
        {
          "n": 1,
          "notes": "Price may pull customers away."
        },
        {
          "n": 2,
          "notes": "A smart plan can win them back."
        },
        {
          "n": 3,
          "notes": "Thank you. This was a fictional brief."
        }
      ]
    }
  ]
}